{
  "$schema": "https://json-schema.org/draft/2020-12/schema",
  "$id": "https://ledgerops.dev/contracts/v1/SubmitReversalToProvider.schema.json",
  "title": "SubmitReversalToProvider v1",
  "type": "object",
  "additionalProperties": true,
  "required": [
    "attemptId",
    "paymentId",
    "reversalId",
    "operationType",
    "attemptSequence",
    "providerId",
    "providerIdempotencyKey",
    "amount",
    "currency",
    "paymentMethodCategory",
    "merchantId",
    "originalProviderReference",
    "requestIntentHash"
  ],
  "properties": {
    "attemptId": { "type": "string", "format": "uuid" },
    "paymentId": { "type": "string", "format": "uuid" },
    "reversalId": { "type": "string", "format": "uuid" },
    "operationType": { "const": "REVERSAL" },
    "attemptSequence": { "type": "integer", "minimum": 1, "maximum": 3 },
    "providerId": { "const": "SIMULATOR" },
    "providerIdempotencyKey": {
      "type": "string",
      "pattern": "^reversal:[0-9a-f]{8}-[0-9a-f]{4}-[0-9a-f]{4}-[0-9a-f]{4}-[0-9a-f]{12}$"
    },
    "amount": { "type": "string", "pattern": "^(0|[1-9][0-9]*)(\\.[0-9]+)?$" },
    "currency": { "type": "string", "pattern": "^[A-Z]{3}$" },
    "paymentMethodCategory": { "type": "string", "minLength": 1 },
    "merchantId": { "type": "string", "format": "uuid" },
    "originalProviderReference": { "type": "string", "minLength": 1 },
    "requestIntentHash": { "type": "string", "pattern": "^[0-9a-f]{64}$" }
  }
}
